{
  "$schema": "./test-suite.schema.json",
  "suite": "skill-eng-gate1-code-review",
  "version": "1.0.0",
  "description": "Validation test suite for Gate 1 Local Code Validation and Review Skill. Covers all 14 required capabilities: build/test success/failure, uncommitted changes, polyglot repos, 0-10 scoring, critical overrides, minor passes, tool availability, agent resilience, aggregation, parity, schema compliance, and safety.",
  "testCases": [
    {
      "id": "TC-001",
      "description": "Successful local build and passing automated tests with zero violations yields PASS (10/10).",
      "category": "clean_execution",
      "executionMode": "both",
      "inputs": {
        "repository": {
          "stacks": ["Python"],
          "changedFiles": ["src/pricing.py"],
          "fixturePath": "validation/test-data/TC-001-clean-feature.py",
          "hasUncommitted": true,
          "hasUntracked": false
        },
        "mockBuild": {
          "command": "python -m py_compile src/pricing.py",
          "exitCode": 0,
          "available": true,
          "errors": []
        },
        "mockTests": {
          "command": "pytest tests/",
          "exitCode": 0,
          "available": true,
          "total": 12,
          "passed": 12,
          "failed": 0,
          "skipped": 0,
          "failures": []
        },
        "mockDimensions": {
          "security": { "score": 10.0, "blocked": false, "findings": [] },
          "performance": { "score": 10.0, "blocked": false, "findings": [] },
          "maintainability": { "score": 10.0, "blocked": false, "findings": [] },
          "modularity": { "score": 10.0, "blocked": false, "findings": [] },
          "business_logic": { "score": 10.0, "blocked": false, "findings": [] }
        }
      },
      "expected": {
        "status": "PASS",
        "ready_for_pr": true,
        "buildStatus": "passed",
        "testStatus": "passed",
        "blockingReasonsCount": 0
      }
    },
    {
      "id": "TC-002",
      "description": "Build compilation syntax error immediately yields BLOCKED regardless of tests or review dimensions.",
      "category": "build_failure",
      "executionMode": "both",
      "inputs": {
        "repository": {
          "stacks": ["TypeScript"],
          "changedFiles": ["src/user.ts"],
          "fixturePath": "validation/test-data/TC-002-syntax-error.ts",
          "hasUncommitted": true,
          "hasUntracked": false
        },
        "mockBuild": {
          "command": "tsc --noEmit",
          "exitCode": 1,
          "available": true,
          "errors": ["src/user.ts(9,42): error TS1002: Unterminated string literal"]
        },
        "mockTests": {
          "command": "npm test",
          "exitCode": 0,
          "available": true,
          "total": 0,
          "passed": 0,
          "failed": 0,
          "skipped": 0,
          "failures": []
        },
        "mockDimensions": {
          "security": { "score": 10.0, "blocked": false, "findings": [] },
          "performance": { "score": 10.0, "blocked": false, "findings": [] },
          "maintainability": { "score": 10.0, "blocked": false, "findings": [] },
          "modularity": { "score": 10.0, "blocked": false, "findings": [] },
          "business_logic": { "score": 10.0, "blocked": false, "findings": [] }
        }
      },
      "expected": {
        "status": "BLOCKED",
        "ready_for_pr": false,
        "buildStatus": "failed",
        "testStatus": "passed",
        "blockingReasonsCount": 1
      }
    },
    {
      "id": "TC-003",
      "description": "Automated test suite assertion failure yields BLOCKED with failure details recorded.",
      "category": "test_failure",
      "executionMode": "both",
      "inputs": {
        "repository": {
          "stacks": ["Python"],
          "changedFiles": ["src/math.py", "tests/test_math.py"],
          "fixturePath": "validation/test-data/TC-003-broken-tests.py",
          "hasUncommitted": true,
          "hasUntracked": false
        },
        "mockBuild": {
          "command": "python -m py_compile src/math.py",
          "exitCode": 0,
          "available": true,
          "errors": []
        },
        "mockTests": {
          "command": "pytest tests/test_math.py",
          "exitCode": 1,
          "available": true,
          "total": 5,
          "passed": 4,
          "failed": 1,
          "skipped": 0,
          "failures": [
            {
              "test_name": "test_divide_positive",
              "error_message": "AssertionError: 20 != 5.0",
              "file": "tests/test_math.py"
            }
          ]
        },
        "mockDimensions": {
          "security": { "score": 10.0, "blocked": false, "findings": [] },
          "performance": { "score": 10.0, "blocked": false, "findings": [] },
          "maintainability": { "score": 10.0, "blocked": false, "findings": [] },
          "modularity": { "score": 10.0, "blocked": false, "findings": [] },
          "business_logic": { "score": 10.0, "blocked": false, "findings": [] }
        }
      },
      "expected": {
        "status": "BLOCKED",
        "ready_for_pr": false,
        "buildStatus": "passed",
        "testStatus": "failed",
        "blockingReasonsCount": 1
      }
    },
    {
      "id": "TC-004",
      "description": "Uncommitted and untracked changes in local working tree are discovered and inspected without requiring a remote PR.",
      "category": "uncommitted_changes",
      "executionMode": "local",
      "inputs": {
        "repository": {
          "stacks": ["Python"],
          "changedFiles": ["src/shipping.py"],
          "fixturePath": "validation/test-data/TC-004-uncommitted-feature.py",
          "hasUncommitted": true,
          "hasUntracked": true
        },
        "mockBuild": {
          "command": "python -m py_compile src/shipping.py",
          "exitCode": 0,
          "available": true,
          "errors": []
        },
        "mockTests": {
          "command": "pytest tests/",
          "exitCode": 0,
          "available": true,
          "total": 8,
          "passed": 8,
          "failed": 0,
          "skipped": 0,
          "failures": []
        },
        "mockDimensions": {
          "security": { "score": 10.0, "blocked": false, "findings": [] },
          "performance": { "score": 10.0, "blocked": false, "findings": [] },
          "maintainability": { "score": 10.0, "blocked": false, "findings": [] },
          "modularity": { "score": 10.0, "blocked": false, "findings": [] },
          "business_logic": { "score": 10.0, "blocked": false, "findings": [] }
        }
      },
      "expected": {
        "status": "PASS",
        "ready_for_pr": true,
        "buildStatus": "passed",
        "testStatus": "passed",
        "blockingReasonsCount": 0
      }
    },
    {
      "id": "TC-005",
      "description": "Polyglot repository with Python backend and React frontend activates multi-stack inspection and review.",
      "category": "polyglot_repository",
      "executionMode": "both",
      "inputs": {
        "repository": {
          "stacks": ["Python", "TypeScript", "React"],
          "changedFiles": ["api/products.py", "web/ProductView.tsx"],
          "fixturePath": "validation/test-data/TC-005-polyglot-backend.py",
          "hasUncommitted": true,
          "hasUntracked": false
        },
        "mockBuild": {
          "command": "python -m py_compile api/products.py && npm run build",
          "exitCode": 0,
          "available": true,
          "errors": []
        },
        "mockTests": {
          "command": "pytest api/ && npm test",
          "exitCode": 0,
          "available": true,
          "total": 24,
          "passed": 24,
          "failed": 0,
          "skipped": 0,
          "failures": []
        },
        "mockDimensions": {
          "security": { "score": 10.0, "blocked": false, "findings": [] },
          "performance": { "score": 10.0, "blocked": false, "findings": [] },
          "maintainability": { "score": 10.0, "blocked": false, "findings": [] },
          "modularity": { "score": 10.0, "blocked": false, "findings": [] },
          "business_logic": { "score": 10.0, "blocked": false, "findings": [] }
        }
      },
      "expected": {
        "status": "PASS",
        "ready_for_pr": true,
        "buildStatus": "passed",
        "testStatus": "passed",
        "blockingReasonsCount": 0
      }
    },
    {
      "id": "TC-006",
      "description": "Maintainability dimension score below 9.0 (score = 6.0 due to high complexity) blocks PR readiness.",
      "category": "dimension_score_block",
      "executionMode": "both",
      "inputs": {
        "repository": {
          "stacks": ["Python"],
          "changedFiles": ["src/orders.py"],
          "fixturePath": "validation/test-data/TC-006-high-complexity.py",
          "hasUncommitted": true,
          "hasUntracked": false
        },
        "mockBuild": {
          "command": "python -m py_compile src/orders.py",
          "exitCode": 0,
          "available": true,
          "errors": []
        },
        "mockTests": {
          "command": "pytest tests/",
          "exitCode": 0,
          "available": true,
          "total": 10,
          "passed": 10,
          "failed": 0,
          "skipped": 0,
          "failures": []
        },
        "mockDimensions": {
          "security": { "score": 10.0, "blocked": false, "findings": [] },
          "performance": { "score": 10.0, "blocked": false, "findings": [] },
          "maintainability": {
            "score": 6.0,
            "blocked": true,
            "findings": [
              {
                "ruleId": "MAINT02",
                "title": "Deeply nested control flow (nesting depth 7)",
                "severity": "high",
                "confidence": "high",
                "file": "src/orders.py",
                "lineStart": 2,